{
  "counts": {
    "exceptions": 0,
    "findings": 30,
    "inputs": 8,
    "proof_obligations": 10,
    "risks": 8,
    "stop_conditions": 5
  },
  "decision_effect": "eligible-for-multidisciplinary-review-with-bounded-conditions",
  "exceptions": [],
  "findings": [
    {
      "decision_effect": "Retained as active evidence and carried to review.",
      "disposition": "closed-active-pass",
      "finding": "The pinned Chromium host reached application readiness through the Phoenix profile, Popcorn/AtomVM Wasm runtime, governed AVM, and Elixir echo bridge.",
      "id": "BX-BH01-PHASE4-FINDING-01",
      "owner": "bh01-owner",
      "source": "integration/fixtures/raw-evidence/bh01-phase4-browser.json"
    },
    {
      "decision_effect": "Retained as active evidence and carried to review.",
      "disposition": "closed-active-pass",
      "finding": "Three same-page activation generations and one warm navigation converged to zero lifecycle-owned resources after stop.",
      "id": "BX-BH01-PHASE4-FINDING-02",
      "owner": "bh01-owner",
      "source": "integration/fixtures/raw-evidence/bh01-phase4-browser.json"
    },
    {
      "decision_effect": "Retained as active evidence and carried to review.",
      "disposition": "closed-active-pass",
      "finding": "Missing cross-origin isolation, manifest network failure, and Wasm integrity drift failed intentionally without promoting browser support.",
      "id": "BX-BH01-PHASE4-FINDING-03",
      "owner": "bh01-owner",
      "source": "integration/fixtures/raw-evidence/bh01-phase4-browser.json"
    },
    {
      "decision_effect": "Retained as active evidence and carried to review.",
      "disposition": "accepted-bounded-condition",
      "finding": "Popcorn 0.3.3 requires unsafe-eval for its current bridge implementation; this remains explicit feasibility security debt.",
      "id": "BX-BH01-PHASE4-FINDING-04",
      "owner": "bh01-owner",
      "source": "integration/fixtures/raw-evidence/bh01-phase4-browser.json"
    },
    {
      "decision_effect": "Retained as active evidence and carried to review.",
      "disposition": "closed-active-pass",
      "finding": "Elixir-authored state, keyed nesting, form validation, timers, and process messages produced bounded DOM operations in the pinned browser runtime.",
      "id": "BX-BH01-PHASE5-FINDING-01",
      "owner": "bh01-owner",
      "source": "integration/fixtures/raw-evidence/bh01-phase5-local-browser.json"
    },
    {
      "decision_effect": "Retained as active evidence and carried to review.",
      "disposition": "closed-active-pass",
      "finding": "Two independent executions produced byte-identical normalized semantic traces and no local-behavior network request after readiness.",
      "id": "BX-BH01-PHASE5-FINDING-02",
      "owner": "bh01-owner",
      "source": "integration/fixtures/raw-evidence/bh01-phase5-local-browser.json"
    },
    {
      "decision_effect": "Retained as active evidence and carried to review.",
      "disposition": "closed-active-pass",
      "finding": "A replacement activation used generation 2 and completed an AtomVM timer without accepting generation-1 ownership.",
      "id": "BX-BH01-PHASE5-FINDING-03",
      "owner": "bh01-owner",
      "source": "integration/fixtures/raw-evidence/bh01-phase5-local-browser.json"
    },
    {
      "decision_effect": "Retained as active evidence and carried to review.",
      "disposition": "closed-active-pass",
      "finding": "Explicit stop converged fixture, DOM, bridge, and lifecycle ownership; renderer negatives failed before partial mutation.",
      "id": "BX-BH01-PHASE5-FINDING-04",
      "owner": "bh01-owner",
      "source": "integration/fixtures/raw-evidence/bh01-phase5-local-browser.json"
    },
    {
      "decision_effect": "Retained as active evidence and carried to review.",
      "disposition": "resolved-and-retested",
      "finding": "The first browser run exposed the unavailable Erlang re NIF behind Regex.match?/2 in AtomVM; byte-level identifier validation replaced it and a source guard now prevents regression.",
      "id": "BX-BH01-PHASE6-FINDING-01",
      "owner": "bh01-owner",
      "source": "integration/fixtures/raw-evidence/bh01-phase6-trust-and-isolation.json"
    },
    {
      "decision_effect": "Retained as active evidence and carried to review.",
      "disposition": "closed-active-pass",
      "finding": "A normalized DOM action crossed the Elixir runtime, bridge, same-origin transport, Phoenix endpoint, server authority, audit, and DOM result path.",
      "id": "BX-BH01-PHASE6-FINDING-02",
      "owner": "bh01-owner",
      "source": "integration/fixtures/raw-evidence/bh01-phase6-trust-and-isolation.json"
    },
    {
      "decision_effect": "Retained as active evidence and carried to review.",
      "disposition": "closed-active-pass",
      "finding": "Server-owned session identity, authorization, current resource version, idempotency, rate, and side effect remained outside browser runtime state.",
      "id": "BX-BH01-PHASE6-FINDING-03",
      "owner": "bh01-owner",
      "source": "integration/fixtures/raw-evidence/bh01-phase6-trust-and-isolation.json"
    },
    {
      "decision_effect": "Retained as active evidence and carried to review.",
      "disposition": "closed-active-pass",
      "finding": "Mismatch and failure outcomes were bounded; disconnect retry applied once and disposal aborted pending transport without delivering a late runtime result.",
      "id": "BX-BH01-PHASE6-FINDING-04",
      "owner": "bh01-owner",
      "source": "integration/fixtures/raw-evidence/bh01-phase6-trust-and-isolation.json"
    },
    {
      "decision_effect": "Retained as active evidence and carried to review.",
      "disposition": "accepted-bounded-condition",
      "finding": "The optional LiveView compatibility adapter reported only exact pinned eligibility and retained standalone-dom as its explicit fallback.",
      "id": "BX-BH01-PHASE6-FINDING-05",
      "owner": "bh01-owner",
      "source": "integration/fixtures/raw-evidence/bh01-phase6-trust-and-isolation.json"
    },
    {
      "decision_effect": "Retained as active evidence and carried to review.",
      "disposition": "closed-active-pass",
      "finding": "Twenty mount/interact/command/failure/retry/dispose cycles converged with no declared transient resource leak.",
      "id": "BX-BH01-PHASE7-FINDING-01",
      "owner": "bh01-owner",
      "source": "integration/fixtures/raw-evidence/bh01-phase7-resilience-security-resource.json"
    },
    {
      "decision_effect": "Retained as active evidence and carried to review.",
      "disposition": "closed-active-pass",
      "finding": "Four interrupted transports recovered under one coordinator and original idempotency identities without duplicate effects.",
      "id": "BX-BH01-PHASE7-FINDING-02",
      "owner": "bh01-owner",
      "source": "integration/fixtures/raw-evidence/bh01-phase7-resilience-security-resource.json"
    },
    {
      "decision_effect": "Retained as active evidence and carried to review.",
      "disposition": "closed-active-pass",
      "finding": "A modified runtime Wasm response failed integrity before runtime readiness.",
      "id": "BX-BH01-PHASE7-FINDING-03",
      "owner": "bh01-owner",
      "source": "integration/fixtures/raw-evidence/bh01-phase7-resilience-security-resource.json"
    },
    {
      "decision_effect": "Retained as active evidence and carried to review.",
      "disposition": "closed-active-pass",
      "finding": "The server rejected direct forged presentation/role input without an effect.",
      "id": "BX-BH01-PHASE7-FINDING-04",
      "owner": "bh01-owner",
      "source": "integration/fixtures/raw-evidence/bh01-phase7-resilience-security-resource.json"
    },
    {
      "decision_effect": "Retained as active evidence and carried to review.",
      "disposition": "accepted-residual-limitation",
      "finding": "Browser worker count remains unavailable at the parent-frame API and is retained as an explained unknown.",
      "id": "BX-BH01-PHASE7-FINDING-05",
      "owner": "bh01-owner",
      "source": "integration/fixtures/raw-evidence/bh01-phase7-resilience-security-resource.json"
    },
    {
      "decision_effect": "Deferred items reactivate at BH-22; exact pins and probes grant no support range.",
      "disposition": "deferred-bh22",
      "finding": "Four of five required browser environments could not execute.",
      "id": "BX-BH01-PHASE8-FINDING-REQUIRED-ENVIRONMENTS",
      "owner": "browser-matrix-owner",
      "source": "integration/fixtures/browser_matrix/matrix-report.json"
    },
    {
      "decision_effect": "Deferred items reactivate at BH-22; exact pins and probes grant no support range.",
      "disposition": "deferred-bh22",
      "finding": "No required browser/assistive-technology pairing or physical/mobile input review executed.",
      "id": "BX-BH01-PHASE8-FINDING-MANUAL-ACCESSIBILITY",
      "owner": "accessibility-owner",
      "source": "integration/fixtures/browser_matrix/matrix-report.json"
    },
    {
      "decision_effect": "Deferred items reactivate at BH-22; exact pins and probes grant no support range.",
      "disposition": "accepted-bounded-condition",
      "finding": "Only the exact Phoenix 1.8.13, Phoenix LiveView 1.2.11, and LocalLiveView 0.1.0 set is qualified; adjacent packages were unavailable.",
      "id": "BX-BH01-PHASE8-FINDING-EXACT-PINS",
      "owner": "liveview-adapter-owner",
      "source": "integration/fixtures/browser_matrix/matrix-report.json"
    },
    {
      "decision_effect": "Deferred items reactivate at BH-22; exact pins and probes grant no support range.",
      "disposition": "informational",
      "finding": "Unqualified Firefox and Linux WebKit probes matched automated semantics and fail-closed behavior but grant no support credit.",
      "id": "BX-BH01-PHASE8-FINDING-PROBES",
      "owner": "browser-matrix-owner",